{
  "schema_version": "0.1.0",
  "asset_id": "gguf-layout-deterministic-v0",
  "asset_kind": "diagram",
  "authority": "authoritative-technical",
  "review_status": "accepted",
  "publication": {
    "publish": true
  },
  "source": {
    "repository": "mohammed-alaa40123/How.to.llama.cpp",
    "revision": "bcb7555ef8b4e80817b5b812c35db6b1c6f7b9a9",
    "input_paths": [
      "labs/fixtures/gguf/synthetic-v0.golden.json"
    ],
    "input_sha256": [
      "ae0fd013da8f7f463e79447978b5a2837e0a52b13029ad6bb23d2fcf3e150968"
    ]
  },
  "generation": {
    "mode": "deterministic",
    "generator": "scripts/generate_gguf_layout_figure.py",
    "generator_version": "0.1.0",
    "model": null,
    "prompt_path": null,
    "prompt_sha256": null,
    "storyboard_path": null,
    "storyboard_sha256": null,
    "manual_trigger": false,
    "cached": true,
    "ordinary_ci_allowed": true
  },
  "output": {
    "path": "media/generated/gguf-layout-deterministic-v0.svg",
    "mime_type": "image/svg+xml",
    "sha256": "3482f28bde713b4bf335007df8f2a1b73e0aaee8e88186a5c6419063e1b3b178",
    "bytes": 2526
  },
  "accessibility": {
    "alt_text": "A deterministic diagram of the 428-byte synthetic GGUF file showing header and metadata bytes, aligned tensor data, and the bounded demo.matrix and demo.vector payload ranges.",
    "caption_path": null,
    "transcript_path": null,
    "static_fallback_path": "docs/labs/legal-fixture-decision.md",
    "reduced_motion_safe": true
  },
  "technical_claims": [
    {
      "claim": "The synthetic teaching fixture separates GGUF metadata and tensor payload ranges using deterministic offsets and alignment.",
      "evidence_kind": "verified"
    }
  ],
  "licensing": {
    "asset_license": "MIT",
    "input_license_notes": "Project-owned synthetic fixture and deterministic rendering inputs only.",
    "redistribution_allowed": true
  },
  "human_review": {
    "required": true,
    "approved": true,
    "reviewer_role": "Documentation Builder technical review",
    "reviewed_at": "2026-07-17T05:50:00+03:00",
    "notes": "The generated SVG was replayed from the golden JSON and its input hash, output hash, output size, accessibility metadata, and evidence boundary were verified by focused tests. Independent domain review remains required before publication claims rely on the figure."
  }
}
